{
  "$schema": "http://json-schema.org/draft-07/schema#",
  "$id": "species.schema.json",
  "title": "Species",
  "type": "object",
  "required": ["schemaVersion", "id", "name", "category", "tasks"],
  "additionalProperties": false,
  "properties": {
    "schemaVersion": { "const": 1 },
    "id": { "type": "string", "pattern": "^[a-z0-9]+(-[a-z0-9]+)*$" },
    "name": { "type": "string", "minLength": 1 },
    "latin": { "type": "string" },
    "category": {
      "type": "string",
      "enum": ["groente", "fruit", "kruid", "vaste-plant", "bolgewas", "struik", "boom"]
    },
    "tags": { "type": "array", "items": { "type": "string" } },
    "nativeStatus": {
      "type": "string",
      "enum": ["inheems", "archeofyt", "exoot", "onbekend"],
      "description": "Herkomststatus t.o.v. de Nederlandse flora, voor de tijdlijnweergave. 'onbekend' dekt ook soort-onzekerheid (bv. verzamelnamen als 'Hosta spp.')."
    },
    "appearance": {
      "type": "object",
      "additionalProperties": false,
      "required": ["shape", "count", "flowerColor"],
      "properties": {
        "shape": {
          "type": "string",
          "enum": ["vrucht", "aar", "bloem", "losse-wolk"],
          "description": "Bepaalt de volledige opbouw/silhouet van het icoon."
        },
        "count": {
          "type": "integer",
          "minimum": 1,
          "maximum": 10,
          "description": "Aantal elementen (vruchtjes/aar-segmenten/bloemblaadjes/wolk-vlekken)."
        },
        "flowerColor": { "type": "string", "pattern": "^#[0-9a-fA-F]{6}$" },
        "flowerColorName": { "type": "string" },
        "fruitColor": {
          "type": "string",
          "pattern": "^#[0-9a-fA-F]{6}$",
          "description": "Kleurt de vruchtjes van het icoon; verplicht wanneer shape=\"vrucht\"."
        }
      },
      "if": { "properties": { "shape": { "const": "vrucht" } } },
      "then": { "required": ["fruitColor"] }
    },
    "bloom": {
      "type": "object",
      "additionalProperties": false,
      "required": ["from", "to"],
      "properties": {
        "from": { "$ref": "#/definitions/monthDay" },
        "to": { "$ref": "#/definitions/monthDay" }
      },
      "description": "Bloeiperiode, puur informatief (geen taak) — kleur komt uit appearance.flowerColor."
    },
    "growing": {
      "type": "object",
      "additionalProperties": false,
      "description": "Groeiomstandigheden als vaste waarden, zodat erop te filteren is.",
      "properties": {
        "sun": {
          "type": "array",
          "minItems": 1,
          "uniqueItems": true,
          "items": { "type": "string", "enum": ["zon", "halfschaduw", "schaduw"] }
        },
        "soil": {
          "type": "array",
          "minItems": 1,
          "uniqueItems": true,
          "items": { "type": "string", "enum": ["zand", "klei", "leem", "veen"] },
          "description": "Grondsoorten waarop de plant goed groeit."
        },
        "moisture": {
          "type": "array",
          "minItems": 1,
          "uniqueItems": true,
          "items": { "type": "string", "enum": ["droog", "normaal", "vochtig", "nat"] },
          "description": "Hoe vochtig de grond mag/moet zijn."
        },
        "spacingCm": { "type": "integer", "minimum": 1, "description": "Plantafstand in centimeters." },
        "height": {
          "type": "object",
          "additionalProperties": false,
          "required": ["minCm", "maxCm"],
          "description": "Gebruikelijke eindhoogte van–tot in centimeters (bij klimplanten de klimhoogte). maxCm >= minCm.",
          "properties": {
            "minCm": { "type": "integer", "minimum": 1 },
            "maxCm": { "type": "integer", "minimum": 1 }
          }
        }
      }
    },
    "info": {
      "type": "object",
      "additionalProperties": false,
      "description": "Plantinformatie voor in het detailvenster.",
      "properties": {
        "intro": { "type": "string", "minLength": 1, "description": "Wat voor plant het is en waarom je hem kweekt (2-3 zinnen)." },
        "water": { "type": "string", "minLength": 1, "description": "Hoeveel en wanneer water geven." },
        "tips": { "type": "array", "items": { "type": "string", "minLength": 1 }, "description": "Losse tips en valkuilen." }
      }
    },
    "tasks": {
      "type": "array",
      "minItems": 1,
      "items": { "$ref": "#/definitions/task" }
    }
  },
  "definitions": {
    "monthDay": {
      "type": "string",
      "pattern": "^(0[1-9]|1[0-2])-(0[1-9]|[12][0-9]|3[01])$"
    },
    "task": {
      "type": "object",
      "required": ["id", "type", "window"],
      "additionalProperties": false,
      "properties": {
        "id": { "type": "string", "pattern": "^[a-z0-9]+(-[a-z0-9]+)*$" },
        "type": { "type": "string" },
        "importance": {
          "type": "string",
          "enum": ["hoofd", "licht"],
          "description": "Alleen relevant voor weergave (bv. dikte/opacity van het snoei-icoon). Standaard 'hoofd' als weggelaten."
        },
        "location": {
          "type": "string",
          "enum": ["kas", "grond"],
          "description": "Alleen relevant voor zaaien: 'kas' (ook voorzaaien binnen) of 'grond' (volle grond). Standaard 'grond' als weggelaten."
        },
        "note": {
          "type": "string",
          "description": "Korte hint voor maandoverzicht en print. Spaarzaam gebruiken: alleen als het echt helpt."
        },
        "description": {
          "type": "string",
          "minLength": 1,
          "description": "Uitgebreidere uitleg (een paar zinnen): hoe, waar op letten en waarom. Alleen in het detailvenster."
        },
        "conditions": {
          "type": "object",
          "additionalProperties": false,
          "properties": {
            "position": { "type": "array", "items": { "type": "string" } },
            "soil": { "type": "array", "items": { "type": "string" } }
          }
        },
        "window": {
          "oneOf": [
            {
              "type": "object",
              "required": ["kind", "from", "to"],
              "additionalProperties": false,
              "properties": {
                "kind": { "const": "dates" },
                "from": { "$ref": "#/definitions/monthDay" },
                "to": { "$ref": "#/definitions/monthDay" }
              }
            },
            {
              "type": "object",
              "required": ["kind", "from", "to", "every"],
              "additionalProperties": false,
              "properties": {
                "kind": { "const": "recurring" },
                "from": { "$ref": "#/definitions/monthDay" },
                "to": { "$ref": "#/definitions/monthDay" },
                "every": { "type": "string", "enum": ["week", "2weeks", "month"] }
              }
            },
            {
              "type": "object",
              "required": ["kind", "anchor", "fromWeeks", "toWeeks"],
              "additionalProperties": false,
              "properties": {
                "kind": { "const": "relative" },
                "anchor": { "type": "string", "enum": ["lastFrost", "firstFrost", "soilWarm"] },
                "fromWeeks": { "type": "integer" },
                "toWeeks": { "type": "integer" }
              }
            }
          ]
        }
      }
    }
  }
}
