{
  "schemaVersion": 1,
  "id": "bergamotplant",
  "name": "Bergamotplant",
  "latin": "Monarda didyma",
  "category": "vaste-plant",
  "tags": [
    "meerjarig",
    "geurend",
    "vlinderplant",
    "eetbaar"
  ],
  "nativeStatus": "exoot",
  "appearance": {
    "shape": "bloem",
    "count": 8,
    "flowerColor": "#C8324B",
    "flowerColorName": "rood"
  },
  "bloom": {
    "from": "07-01",
    "to": "09-15"
  },
  "growing": {
    "sun": [
      "zon",
      "halfschaduw"
    ],
    "soil": [
      "klei",
      "leem"
    ],
    "moisture": [
      "normaal",
      "vochtig"
    ],
    "spacingCm": 45,
    "height": {
      "minCm": 60,
      "maxCm": 120
    }
  },
  "info": {
    "intro": "Vaste plant met kransen rode, roze of paarse bloemen boven elkaar. Het blad ruikt naar bergamot en is lekker in thee.",
    "water": "Houd de grond vochtig; bij droogte krijgt hij snel meeldauw (witte schimmel op het blad).",
    "tips": [
      "Kies een luchtige plek om meeldauw te voorkomen."
    ]
  },
  "tasks": [
    {
      "id": "planten",
      "type": "planten",
      "window": {
        "kind": "dates",
        "from": "03-15",
        "to": "05-01"
      },
      "description": "Plant op zo'n 45 cm afstand in voedzame, vochthoudende grond."
    },
    {
      "id": "oogsten",
      "type": "oogsten",
      "window": {
        "kind": "dates",
        "from": "06-15",
        "to": "08-31"
      },
      "description": "Pluk blad en bloemen voor thee, vers of gedroogd."
    },
    {
      "id": "terugknippen",
      "type": "snoeien",
      "window": {
        "kind": "dates",
        "from": "10-15",
        "to": "11-30"
      },
      "description": "Knip de stengels af tot net boven de grond."
    },
    {
      "id": "delen",
      "type": "delen",
      "window": {
        "kind": "dates",
        "from": "03-15",
        "to": "04-15"
      },
      "description": "Verdeel de pol om de drie jaar en gooi het oude midden weg; dat sterft anders af."
    }
  ]
}
