{
  "schemaVersion": 1,
  "id": "zwarte-bes",
  "name": "Zwarte bes",
  "latin": "Ribes nigrum",
  "category": "fruit",
  "tags": [
    "struik"
  ],
  "nativeStatus": "inheems",
  "appearance": {
    "shape": "vrucht",
    "count": 5,
    "flowerColor": "#C8B8A0",
    "flowerColorName": "groenbruin",
    "fruitColor": "#2A1E2E"
  },
  "bloom": {
    "from": "04-15",
    "to": "05-15"
  },
  "growing": {
    "sun": [
      "zon",
      "halfschaduw"
    ],
    "soil": [
      "klei",
      "leem"
    ],
    "moisture": [
      "normaal",
      "vochtig"
    ],
    "spacingCm": 150,
    "height": {
      "minCm": 120,
      "maxCm": 180
    }
  },
  "info": {
    "intro": "Bessenstruik met aromatische, vitaminerijke zwarte bessen voor jam, siroop en cassis.",
    "water": "Geef water in droge periodes; zwarte bes houdt van vochtige grond.",
    "tips": [
      "Anders dan rode bes draagt zwarte bes vooral aan de jonge takken van vorig jaar: haal dus juist de oude takken weg.",
      "Een net houdt de vogels weg."
    ]
  },
  "tasks": [
    {
      "id": "planten",
      "type": "planten",
      "window": {
        "kind": "dates",
        "from": "11-01",
        "to": "03-15"
      },
      "description": "Plant in de winterrust op 1,5 m afstand, 5 cm dieper dan hij stond; dan komen er meer nieuwe scheuten uit de grond."
    },
    {
      "id": "snoeien",
      "type": "snoeien",
      "window": {
        "kind": "dates",
        "from": "08-01",
        "to": "02-28"
      },
      "description": "Zaag elk jaar een derde van de oudste takken bij de grond weg. Zo komen er steeds jonge, vruchtbare takken bij."
    },
    {
      "id": "oogsten",
      "type": "oogsten",
      "window": {
        "kind": "dates",
        "from": "07-01",
        "to": "07-31"
      },
      "description": "Pluk hele trosjes als alle bessen zwart en glanzend zijn."
    }
  ]
}
