{
  "schemaVersion": 1,
  "id": "zinnia",
  "name": "Zinnia",
  "latin": "Zinnia elegans",
  "category": "vaste-plant",
  "tags": [
    "eenjarig",
    "snijbloem",
    "vlinderplant",
    "vorstgevoelig"
  ],
  "nativeStatus": "exoot",
  "appearance": {
    "shape": "bloem",
    "count": 10,
    "flowerColor": "#F05A5A",
    "flowerColorName": "rood-oranje"
  },
  "bloom": {
    "from": "07-15",
    "to": "10-15"
  },
  "growing": {
    "sun": [
      "zon"
    ],
    "soil": [
      "klei",
      "leem",
      "zand"
    ],
    "moisture": [
      "normaal"
    ],
    "spacingCm": 30,
    "height": {
      "minCm": 30,
      "maxCm": 80
    }
  },
  "info": {
    "intro": "Eenjarige zomerbloem met stevige bloemen in felle kleuren en een van de beste snijbloemen: hoe meer je plukt, hoe meer hij bloeit.",
    "water": "Geef bij droogte water op de grond, niet over het blad; dat voorkomt meeldauw.",
    "tips": [
      "Kou verdraagt hij slecht: te vroeg zaaien of uitplanten geeft zwakke planten.",
      "Knip de top eruit boven een bladpaar als de plant 20 cm is, voor meer bloemstelen.",
      "Op zware, koude, natte grond groeit hij slecht."
    ]
  },
  "tasks": [
    {
      "id": "zaaien-binnen",
      "type": "zaaien",
      "location": "kas",
      "window": {
        "kind": "dates",
        "from": "04-15",
        "to": "05-15"
      },
      "description": "Zaai in potjes, 0,5 cm diep, op een warme plek."
    },
    {
      "id": "zaaien",
      "type": "zaaien",
      "window": {
        "kind": "dates",
        "from": "05-15",
        "to": "06-15"
      },
      "description": "Zaai als de grond warm is en dun uit tot 30 cm."
    },
    {
      "id": "uitplanten",
      "type": "planten",
      "window": {
        "kind": "relative",
        "anchor": "lastFrost",
        "fromWeeks": 1,
        "toWeeks": 4
      },
      "note": "Pas na de laatste nachtvorst",
      "description": "Plant op een zonnige, beschutte plek, 30 cm uit elkaar."
    },
    {
      "id": "plukken",
      "type": "oogsten",
      "window": {
        "kind": "recurring",
        "from": "07-15",
        "to": "10-01",
        "every": "week"
      },
      "description": "Pluk als de bloem helemaal open is en de steel stevig. Knip diep, net boven een bladpaar."
    }
  ]
}
