{
  "schemaVersion": 1,
  "id": "lieve-vrouwe-bedstro",
  "name": "Lieve-vrouwe-bedstro",
  "latin": "Galium odoratum",
  "category": "kruid",
  "tags": [
    "meerjarig",
    "bodembedekker",
    "schaduwplant"
  ],
  "nativeStatus": "inheems",
  "appearance": {
    "shape": "losse-wolk",
    "count": 5,
    "flowerColor": "#F5F1E6",
    "flowerColorName": "wit"
  },
  "bloom": {
    "from": "05-01",
    "to": "06-01"
  },
  "growing": {
    "sun": [
      "schaduw",
      "halfschaduw"
    ],
    "soil": [
      "leem",
      "klei",
      "zand"
    ],
    "moisture": [
      "normaal",
      "vochtig"
    ],
    "spacingCm": 25,
    "height": {
      "minCm": 15,
      "maxCm": 30
    }
  },
  "info": {
    "intro": "Inheemse bodembedekker voor de schaduw, met kransen van blad en witte stervormige bloemetjes in mei. Verwelkt of gedroogd ruikt hij naar hooi en vanille.",
    "water": "Onder bomen en struiken meestal vanzelf vochtig genoeg; geef in droge zomers extra water.",
    "tips": [
      "Groeit het best in bosachtige grond met veel bladaarde.",
      "Verspreidt zich met uitlopers tot een dicht tapijt."
    ]
  },
  "tasks": [
    {
      "id": "planten",
      "type": "planten",
      "window": {
        "kind": "dates",
        "from": "03-15",
        "to": "05-01"
      },
      "description": "Plant op zo'n 25 cm afstand, bijvoorbeeld onder struiken of bomen. Meng bladaarde of compost door de grond en houd de plantjes de eerste weken vochtig."
    },
    {
      "id": "oogsten",
      "type": "oogsten",
      "window": {
        "kind": "dates",
        "from": "04-15",
        "to": "05-15"
      },
      "description": "Pluk de stengels vlak voor de bloei en laat ze een dag verwelken, dan komt de vanillegeur vrij (bijvoorbeeld voor meiwijn). Gebruik met mate: veel is niet gezond."
    },
    {
      "id": "delen",
      "type": "delen",
      "window": {
        "kind": "dates",
        "from": "09-15",
        "to": "10-15"
      },
      "description": "Steek plakken met wortels uit en plant ze op een nieuwe schaduwplek."
    }
  ]
}
