{
  "schemaVersion": 1,
  "id": "paksoi",
  "name": "Paksoi",
  "latin": "Brassica rapa subsp. chinensis",
  "category": "groente",
  "tags": [
    "eenjarig"
  ],
  "nativeStatus": "exoot",
  "appearance": {
    "shape": "losse-wolk",
    "count": 3,
    "flowerColor": "#B7CC8C",
    "flowerColorName": "groen"
  },
  "growing": {
    "sun": [
      "zon",
      "halfschaduw"
    ],
    "soil": [
      "klei",
      "leem",
      "zand"
    ],
    "moisture": [
      "normaal",
      "vochtig"
    ],
    "spacingCm": 25
  },
  "info": {
    "intro": "Een snelle Aziatische kool met dikke witte of groene stelen en mals blad. Lekker in roerbakgerechten. Hij houdt van koel weer.",
    "water": "Houd de grond vochtig: droogte laat hem doorschieten.",
    "tips": [
      "Zaai vooral na half juli: in het voorjaar schiet hij snel door.",
      "Jonge babypaksoi kun je al na vier weken oogsten.",
      "Insectengaas helpt tegen aardvlooien."
    ]
  },
  "tasks": [
    {
      "id": "zaaien",
      "type": "zaaien",
      "window": {
        "kind": "dates",
        "from": "07-15",
        "to": "09-15"
      },
      "description": "Zaai in rijen op 30 cm afstand of in potjes, en dun uit tot 25 cm."
    },
    {
      "id": "oogsten",
      "type": "oogsten",
      "window": {
        "kind": "dates",
        "from": "08-15",
        "to": "11-15"
      },
      "description": "Snijd de hele plant af of pluk de buitenste bladeren."
    }
  ]
}
