{
  "schemaVersion": 1,
  "id": "kamperfoelie",
  "name": "Kamperfoelie",
  "latin": "Lonicera periclymenum",
  "category": "struik",
  "tags": [
    "klimmer",
    "meerjarig",
    "geurend"
  ],
  "nativeStatus": "inheems",
  "appearance": {
    "shape": "bloem",
    "count": 4,
    "flowerColor": "#E8D9A0",
    "flowerColorName": "crème-roze"
  },
  "bloom": {
    "from": "06-01",
    "to": "08-15"
  },
  "growing": {
    "sun": [
      "zon",
      "halfschaduw"
    ],
    "soil": [
      "klei",
      "leem",
      "zand"
    ],
    "moisture": [
      "normaal",
      "vochtig"
    ],
    "spacingCm": 150,
    "height": {
      "minCm": 300,
      "maxCm": 600
    }
  },
  "info": {
    "intro": "Inheemse klimplant met geurende bloemen, vooral 's avonds. Trekt nachtvlinders en hommels; vogels eten de rode bessen.",
    "water": "De eerste zomer regelmatig water geven; tegen een muur of schutting ook later bij droogte.",
    "tips": [
      "De rode bessen zijn licht giftig: niet opeten, let op kleine kinderen.",
      "Hij windt zich om steunen: geef draden, gaas of een hek.",
      "Bladluis spuit je weg met een harde straal water."
    ]
  },
  "tasks": [
    {
      "id": "planten",
      "type": "planten",
      "window": {
        "kind": "dates",
        "from": "10-01",
        "to": "11-15"
      },
      "description": "Plant in een ruim gat met compost, 30 cm van muur of hek. Leid de scheuten met een stok naar het rek en mulch de voet, zodat de wortels koel blijven."
    },
    {
      "id": "snoeien",
      "type": "snoeien",
      "importance": "licht",
      "window": {
        "kind": "dates",
        "from": "08-15",
        "to": "09-15"
      },
      "description": "Knip na de bloei de oudste, kale takken weg en kort te lange scheuten in. Zo voorkom je een kale wirwar onderaan met alle bloemen bovenin."
    },
    {
      "id": "bemesten",
      "type": "bemesten",
      "window": {
        "kind": "dates",
        "from": "03-01",
        "to": "03-31"
      },
      "description": "Strooi een laag compost of gedroogde koemest rond de voet. Meer niet: te veel mest geeft vooral blad."
    }
  ]
}
