{
  "schemaVersion": 1,
  "id": "brunel",
  "name": "Gewone brunel",
  "latin": "Prunella vulgaris",
  "category": "vaste-plant",
  "tags": [
    "bodembedekker",
    "bloemenweide",
    "gazon"
  ],
  "nativeStatus": "inheems",
  "appearance": {
    "shape": "bloem",
    "count": 3,
    "flowerColor": "#6E5A9E",
    "flowerColorName": "paars"
  },
  "bloom": {
    "from": "06-01",
    "to": "09-01"
  },
  "growing": {
    "sun": [
      "zon",
      "halfschaduw"
    ],
    "soil": [
      "klei",
      "leem",
      "zand"
    ],
    "moisture": [
      "normaal",
      "vochtig"
    ],
    "spacingCm": 25,
    "height": {
      "minCm": 10,
      "maxCm": 30
    }
  },
  "info": {
    "intro": "Laag, inheems plantje met paarse bloemaartjes van juni tot september. Bijen- en vlinderplant die ook in een bloemrijk gazon groeit, omdat hij maaien verdraagt.",
    "water": "Houd de grond na het planten een paar weken vochtig; daarna alleen water bij lange droogte.",
    "tips": [
      "Hij verspreidt zich met uitlopers en vormt zo een tapijt."
    ]
  },
  "tasks": [
    {
      "id": "planten",
      "type": "planten",
      "window": {
        "kind": "dates",
        "from": "03-15",
        "to": "05-01"
      },
      "description": "Plant op 20 tot 25 cm afstand en geef goed water. Binnen een seizoen groeien de plantjes samen tot een dichte mat."
    },
    {
      "id": "delen",
      "type": "delen",
      "window": {
        "kind": "dates",
        "from": "09-01",
        "to": "10-01"
      },
      "description": "Steek een stuk van de mat met wortels uit en plant het ergens anders. Zo verjong je een oude, kale plek."
    }
  ]
}
