{
  "schemaVersion": 1,
  "id": "tulp",
  "name": "Tulp",
  "latin": "Tulipa spp.",
  "category": "bolgewas",
  "tags": [
    "voorjaarsbloeier"
  ],
  "nativeStatus": "exoot",
  "appearance": {
    "shape": "bloem",
    "count": 1,
    "flowerColor": "#C0392B",
    "flowerColorName": "rood"
  },
  "bloom": {
    "from": "04-01",
    "to": "05-01"
  },
  "growing": {
    "sun": [
      "zon",
      "halfschaduw"
    ],
    "soil": [
      "zand",
      "leem",
      "klei"
    ],
    "moisture": [
      "normaal",
      "droog"
    ],
    "spacingCm": 10,
    "height": {
      "minCm": 20,
      "maxCm": 60
    }
  },
  "info": {
    "intro": "Hét voorjaarsbolgewas van Nederland, in bijna elke kleur. Je plant de bollen in de herfst en in april en mei staan ze in bloei.",
    "water": "Na het planten hoef je bijna nooit water te geven. Tulpen houden niet van natte grond: dan rotten de bollen.",
    "tips": [
      "Veel tulpen bloeien het tweede jaar minder; plant elk najaar wat nieuwe bollen bij.",
      "Botanische tulpen (kleine wilde soorten) komen meestal wel elk jaar terug.",
      "Knip uitgebloeide bloemen af, maar laat het blad staan tot het geel is."
    ]
  },
  "tasks": [
    {
      "id": "planten",
      "type": "planten",
      "window": {
        "kind": "dates",
        "from": "10-15",
        "to": "12-01"
      },
      "description": "Plant de bollen met de punt naar boven, zo diep als drie keer hun eigen hoogte (ongeveer 15 cm), op zo'n 10 cm afstand. Plant ze in groepjes, dat staat mooier dan in een rij. Pas planten als de grond is afgekoeld, vanaf half oktober; dat voorkomt de schimmelziekte 'vuur'."
    },
    {
      "id": "bemesten",
      "type": "bemesten",
      "window": {
        "kind": "dates",
        "from": "02-15",
        "to": "03-15"
      },
      "description": "Strooi aan het eind van de winter, als de punten boven komen, een handje organische bollenmest of wat compost over de plek. Dat helpt de bol om kracht op te bouwen voor volgend jaar."
    },
    {
      "id": "onderhoud",
      "type": "onderhoud",
      "window": {
        "kind": "dates",
        "from": "06-01",
        "to": "06-15"
      },
      "note": "Blad laten afsterven",
      "description": "Laat het blad na de bloei staan tot het geel en verdroogd is; daarmee maakt de bol voeding aan voor volgend jaar. Daarna kun je het blad weghalen. Wil je de plek voor iets anders gebruiken, rooi de bollen dan, laat ze drogen en bewaar ze luchtig tot oktober."
    }
  ]
}
