{
  "schemaVersion": 1,
  "id": "krokus",
  "name": "Krokus",
  "latin": "Crocus spp.",
  "category": "bolgewas",
  "tags": [
    "meerjarig",
    "voorjaarsbloeier"
  ],
  "nativeStatus": "onbekend",
  "appearance": {
    "shape": "bloem",
    "count": 6,
    "flowerColor": "#9B7BD0",
    "flowerColorName": "lila"
  },
  "bloom": {
    "from": "02-15",
    "to": "03-31"
  },
  "growing": {
    "sun": [
      "zon",
      "halfschaduw"
    ],
    "soil": [
      "klei",
      "leem",
      "zand"
    ],
    "moisture": [
      "normaal"
    ],
    "spacingCm": 8,
    "height": {
      "minCm": 5,
      "maxCm": 15
    }
  },
  "info": {
    "intro": "Een van de eerste bloeiers van het jaar, in paars, wit of geel. In februari en maart een belangrijke voedselbron voor hommels en bijen.",
    "water": "Geen extra water nodig.",
    "tips": [
      "Boerenkrokus (Crocus tommasinianus) verwildert het best.",
      "Eten muizen de knollen op, leg dan gaas over het plantgat."
    ]
  },
  "tasks": [
    {
      "id": "planten",
      "type": "planten",
      "window": {
        "kind": "dates",
        "from": "09-15",
        "to": "11-15"
      },
      "description": "Plant 5–8 cm diep met de punt omhoog, in groepjes op zo'n 8 cm afstand; groepen ogen natuurlijker dan rijtjes."
    },
    {
      "id": "blad-laten-staan",
      "type": "onderhoud",
      "window": {
        "kind": "dates",
        "from": "04-01",
        "to": "05-15"
      },
      "note": "Blad laten afsterven",
      "description": "Laat het blad staan tot het geel is: de knol haalt er energie uit voor volgend jaar. Maai er nog niet overheen."
    }
  ]
}
