{
  "schemaVersion": 1,
  "id": "coreopsis",
  "name": "Coreopsis (meisjesogen)",
  "latin": "Coreopsis verticillata",
  "category": "vaste-plant",
  "tags": [
    "meerjarig",
    "droogtebestendig"
  ],
  "nativeStatus": "exoot",
  "appearance": {
    "shape": "bloem",
    "count": 8,
    "flowerColor": "#F2C744",
    "flowerColorName": "geel"
  },
  "bloom": {
    "from": "06-15",
    "to": "09-30"
  },
  "growing": {
    "sun": [
      "zon"
    ],
    "soil": [
      "zand",
      "leem",
      "klei"
    ],
    "moisture": [
      "droog",
      "normaal"
    ],
    "spacingCm": 35,
    "height": {
      "minCm": 30,
      "maxCm": 60
    }
  },
  "info": {
    "intro": "Compacte vaste plant met naaldachtig blad en veel kleine gele sterbloemen, de hele zomer lang.",
    "water": "Kan tegen droogte; alleen water na het planten en bij lange hitte.",
    "tips": [
      "Natte grond in de winter verdraagt hij slecht; plant hem in doorlatende grond."
    ]
  },
  "tasks": [
    {
      "id": "planten",
      "type": "planten",
      "window": {
        "kind": "dates",
        "from": "04-01",
        "to": "05-31"
      },
      "description": "Plant op een zonnige plek op zo'n 35 cm afstand."
    },
    {
      "id": "terugknippen-zomer",
      "type": "snoeien",
      "importance": "licht",
      "window": {
        "kind": "dates",
        "from": "08-01",
        "to": "08-20"
      },
      "description": "Wordt de bloei minder, knip dan de hele plant een derde terug. Na een paar weken bloeit hij opnieuw."
    },
    {
      "id": "terugknippen",
      "type": "snoeien",
      "window": {
        "kind": "dates",
        "from": "03-01",
        "to": "03-31"
      },
      "description": "Knip de oude stengels af tot een paar centimeter boven de grond."
    },
    {
      "id": "delen",
      "type": "delen",
      "window": {
        "kind": "dates",
        "from": "03-15",
        "to": "04-30"
      },
      "description": "Steek de pol om de drie jaar uit en verdeel hem; plant de jonge buitenste stukken terug."
    }
  ]
}
